Name,Type,Phone1,Phone2,Phone3,Phone4,Phone5,Logo URL,Also Known As,Location,Estd.,Website,Mail,Ownership,Approved By,Affiliated to,Link-Affiliated to,Facilities,State Rank,Facebook,Twitter,Youtube,Wikipedia,Total Faculty,Ratio-Student:Faculty,UG Pie Chart,PG Pie Chart,Notable Alumni,Top Following States,Admission Mode,Gender Ratio,Avg. Age,Geometric Insights,Images,Videos,Total Courses,Total UG,Total PG,Courses,,,,,,,,,,,,,,,,,,,,,,,,,,,,,,,,,,,,,,,,,,,,,,,,,,,,,,,,,,,,,,,,,,,,,,,,,,,,,,,,,,,,,,,,,,,,,,,,,,,,,,,,,,,,,,,,,,,,,,,,,,,,,,,,,,,,,,,,,,,,,,,,,,,,,,,,,,,,,,,,,,,,,,,,,,,,,,,,,,,,,,,,,,,,,,,,,,,,,,,,,
School of Engineering and Technology$ Jain University$ Bangalore,Constituent College,8861944441,8123855824,,,,http://www.engineering.careers360.com/sites/default/files/jain_0.jpg,,Harohalli$ Karnataka,2005,http://set.jainuniversity.ac.in/index.html,info.set@jainuniversity.ac.in,Private,University Grants Commission,Jain University$ Bangalore,http://www.university.careers360.com/colleges/jain-university-bangalore,<  # Boys Hostel # Girls Hostel # Gym # Library # Sports # Cafeteria # Auditorium # Medical # Hospital # IT Infrastructure >,,https://www.facebook.com/setjub,https://twitter.com/JUBangalore,https://www.youtube.com/c/JainUniversityindia,https://en.wikipedia.org/wiki/Jain_University,150,23 : 1,< Mechanical Engineering  : 123 >< Information Science Engineering  : 123 >< Computer Science Engineering  : 123 >< Electrical and Electronics Engineering  : 123 >< Civil Engineering  : 123 >< Electronics and Communication Engineering  : 123 >< Aerospace Engineering  : 123 >,,,< Karnataka : 26% >< West Bengal : 14% >,< Exam : Karnataka PGCET # Type : P.G # Level : State Level Exam/Admission >,4 : 1,Average Age Male = 20 Yrs. Average Age Female = 21 Yrs.,< North : 6% >< East : 14% >< South : 46% >< West : 23% >< Central : 11% >,< http://www.engineering.careers360.com/sites/default/files/School%20of%20Engineering%20and%20Technology%2C%20Jain%20University%2C%20Bangalore%20%281%29_0.jpg >< http://www.engineering.careers360.com/sites/default/files/School%20of%20Engineering%20and%20Technology%2C%20Jain%20University%2C%20Bangalore%20%288%29_0.jpg >< http://www.engineering.careers360.com/sites/default/files/School%20of%20Engineering%20and%20Technology%2C%20Jain%20University%2C%20Bangalore%20%283%29_0.jpg >< http://www.engineering.careers360.com/sites/default/files/School%20of%20Engineering%20and%20Technology%2C%20Jain%20University%2C%20Bangalore%20%282%29_0.jpg >< http://www.engineering.careers360.com/sites/default/files/School%20of%20Engineering%20and%20Technology%2C%20Jain%20University%2C%20Bangalore%20%284%29_0.jpg >< http://www.engineering.careers360.com/sites/default/files/School%20of%20Engineering%20and%20Technology%2C%20Jain%20University%2C%20Bangalore%20%285%29_0.jpg >< http://www.engineering.careers360.com/sites/default/files/School%20of%20Engineering%20and%20Technology%2C%20Jain%20University%2C%20Bangalore%20%286%29_0.jpg >< http://www.engineering.careers360.com/sites/default/files/School%20of%20Engineering%20and%20Technology%2C%20Jain%20University%2C%20Bangalore%20%287%29_0.jpg >< http://www.engineering.careers360.com/sites/default/files/School%20of%20Engineering%20and%20Technology%2C%20Jain%20University%2C%20Bangalore%20%289%29_0.jpg >< http://www.engineering.careers360.com/sites/default/files/School%20of%20Engineering%20and%20Technology%2C%20Jain%20University%2C%20Bangalore%20%2810%29_0.jpg >< http://www.engineering.careers360.com/sites/default/files/School%20of%20Engineering%20and%20Technology%2C%20Jain%20University%2C%20Bangalore%20%2811%29_0.jpg >< http://www.engineering.careers360.com/sites/default/files/School%20of%20Engineering%20and%20Technology%2C%20Jain%20University%2C%20Bangalore%20%2812%29_0.jpg >< http://www.engineering.careers360.com/sites/default/files/School%20of%20Engineering%20and%20Technology%2C%20Jain%20University%2C%20Bangalore%20%2813%29_0.jpg >< http://www.engineering.careers360.com/sites/default/files/School%20of%20Engineering%20and%20Technology%2C%20Jain%20University%2C%20Bangalore%20%2814%29_0.jpg >< http://www.engineering.careers360.com/sites/default/files/School%20of%20Engineering%20and%20Technology%2C%20Jain%20University%2C%20Bangalore%20%2815%29_0.jpg >< http://www.engineering.careers360.com/sites/default/files/School%20of%20Engineering%20and%20Technology%2C%20Jain%20University%2C%20Bangalore%20%2816%29_0.jpg >,< http://www.youtube.com/embed/dOtjjByIrHQ >< http://www.youtube.com/embed/v5i7tSYmuA4 >< http://www.youtube.com/embed/DtdhLvUnIbg >< http://www.youtube.com/embed/bAS4lbvNTJI >,20,16,4,"< Course Name : B. TECH AEROSPACE ENGINEERING LATERAL ENTRY # Eligibility : Candidates should have completed Diploma in related branch with minimum of 50% marks # Duration : 3 years # Study mode : Full time # Approved intake : 3 # Course level : UG # Course Fee : 5 lakhs # Approval : University Grants Commission # Details : Through the lateral entry option$ candidates are directly admitted to the third semester (2nd Year) of the B. Tech. degree programme at the School of Engineering and Technology. >< Course Name : B. TECH CIVIL ENGINEERING LATERAL ENTRY # Eligibility : Candidates should have completed Diploma in related branch with minimum of 50% marks # Duration : 3 years # Study mode : Full time # Approved intake : 3 # Course level : UG # Course Fee : 5 lakhs # Approval : University Grants Commission # Details : Through the lateral entry option$ candidates are directly admitted to the third semester (2nd Year) of the B. Tech. degree programme at the School of Engineering and Technology. >< Course Name : B. TECH COMPUTER SCIENCE ENGINEERING LATERAL ENTRY # Eligibility : Candidates should have completed Diploma in related branch with minimum of 50% marks # Duration : 3 years # Study mode : Full time # Approved intake : 3 # Course level : UG # Course Fee : 5 lakhs # Approval : University Grants Commission # Details : Through the lateral entry option$ candidates are directly admitted to the third semester (2nd Year) of the B. Tech. degree programme at the School of Engineering and Technology. >< Course Name : B. TECH ELECTRICAL AND ELECTRONICS ENGINEERING LATERAL ENTRY # Eligibility : Candidates should have completed Diploma in related branch with minimum of 50% marks # Duration : 3 years # Study mode : Full time # Approved intake : 3 # Course level : UG # Course Fee : 5 lakhs # Approval : University Grants Commission # Details : Through the lateral entry option$ candidates are directly admitted to the third semester (2nd Year) of the B. Tech. degree programme at the School of Engineering and Technology. >< Course Name : B. TECH ELECTRONICS AND COMMUNICATION ENGINEERING LATERAL ENTRY # Eligibility : Candidates should have completed Diploma in related branch with minimum of 50% marks # Duration : 3 years # Study mode : Full time # Approved intake : 3 # Course level : UG # Course Fee : 5 lakhs # Approval : University Grants Commission # Details : Through the lateral entry option$ candidates are directly admitted to the third semester (2nd Year) of the B. Tech. degree programme at the School of Engineering and Technology. >< Course Name : B. TECH INFORMATION SCIENCE AND ENGINEERING LATERAL ENTRY # Eligibility : Candidates should have completed Diploma in related branch with minimum of 50% marks # Duration : 3 years # Study mode : Full time # Approved intake : 3 # Course level : UG # Course Fee : 5 lakhs # Approval : University Grants Commission # Details : Through the lateral entry option$ candidates are directly admitted to the third semester (2nd Year) of the B. Tech. degree programme at the School of Engineering and Technology. >< Course Name : B. TECH MECHANICAL ENGINEERING LATERAL ENTRY # Eligibility : Candidates should have completed Diploma in related branch with minimum of 50% marks # Duration : 3 years # Study mode : Full time # Approved intake : 3 # Course level : UG # Course Fee : 5 lakhs # Approval : University Grants Commission # Details : Through the lateral entry option$ candidates are directly admitted to the third semester (2nd Year) of the B. Tech. degree programme at the School of Engineering and Technology. >< Course Name : M. TECH BUILDING SCIENCE AND TECHNOLOGY # Eligibility : B.E / B.Tech Civil Engineering or equivalent / AMIE in the areas mentioned. # Duration : 2 years # Study mode : Full time # Course level : PG # Approval : University Grants Commission # Details :  >< Course Name : M. TECH COMPUTER SCIENCE AND ENGINEERING # Eligibility : B.E / B.Tech in Computer Science Engineering / Information Science Engineering or equivalent / AMIE in the areas mentioned. # Duration : 2 years # Study mode : Full time # Course level : PG # Approval : University Grants Commission # Details :  >< Course Name : M. TECH SIGNAL PROCESSING AND VLSI DESIGN # Eligibility : 1. B.E / B.Tech in Electronics and Communications / Telecommunication Engineering or equivalent / AMIE in the areas mentioned. 2. M.Sc in Electronics. # Duration : 2 years # Study mode : Full time # Course level : PG # Approval : University Grants Commission # Details :  >< Course Name : M. TECH SOFTWARE ENGINEERING # Eligibility : B.E / B.Tech in any branch of Engineering / AMIE. # Duration : 2 years # Study mode : Full time # Course level : PG # Approval : University Grants Commission # Details :  >< Course Name : B. TECH AEROSPACE ENGINEERING # Eligibility : Pass in 12th/PUC/equivalent exams or ISC/CBSE with an average of 45% in Physics$ Mathematics and Chemistry/ Computer Science/ Electronics. In case of SC$ ST and OBC category candidates an average of 40% in Physics$ Mathematics and Chemistry/ Computer Science/ Electronics is required. # Duration : 4 years # Study mode : Full time # Approved intake : 120 # Course level : UG # Course Fee : 7 lakhs # Approval : University Grants Commission # Details : The B.Tech. programme in Aerospace engineering offered by IIAEM$ is unique due to the fact that there are very few institutions in the country which offer such a programme. The curriculum of the programme is designed to meet the requirements of Aerospace organizations and its associates engaged in either production or R&D. >< Course Name : B. TECH CIVIL ENGINEERING # Eligibility : Pass in 12th/PUC/equivalent exams or ISC/CBSE with an average of 45% in Physics$ Mathematics and Chemistry/ Computer Science/ Electronics. In case of SC$ ST and OBC category candidates an average of 40% in Physics$ Mathematics and Chemistry/ Computer Science/ Electronics is required. # Duration : 4 years # Study mode : Full time # Approved intake : 120 # Course level : UG # Course Fee : 5.6 lakhs # Approval : University Grants Commission # Details : The Department of Civil Engineering started in the academic year 2009 offers B.Tech. and Ph.D. programmes in Civil Engineering.Civil engineering is the broadest of the engineering fields. >< Course Name : B. TECH COMPUTER SCIENCE ENGINEERING # Eligibility : Pass in 12th/PUC/equivalent exams or ISC/CBSE with an average of 45% in Physics$ Mathematics and Chemistry/ Computer Science/ Electronics. In case of SC$ ST and OBC category candidates an average of 40% in Physics$ Mathematics and Chemistry/ Computer Science/ Electronics is required. # Duration : 4 years # Study mode : Full time # Approved intake : 120 # Course level : UG # Course Fee : 6.4 lakhs # Approval : University Grants Commission # Details : Sri Bhagawan Mahaveer Jain College of Engineering started in the year 2005 as a constituent college of VTU has grown enormously and transformed into the School of Engineering and Technology under Jain University. The department of Computer Science &amp; Engineering started in the year 2006. The department has well qualified and highly experienced pool of faculty. The faculty pool is a mixture of academicians and persons from the industry also. Currently$ the department has 13 faculty members (6 AP$ 01SL$ 06L). The faculty members are highly dedicated$ concerned$ and sensitive to the duty and their commitment to the students. The faculty makes the single cohesive team of highly spirited teachers. In addition to teaching the faculty is involved in various administrative responsibilities such as student mentoring$ guiding projects$ research activities. Five faculty members are registered for Ph.D. programme under Jain University. >< Course Name : B. TECH ELECTRICAL ENGINEERING # Eligibility : The candidate should have 10+2 from any Recognized Board with relevant subjects. # Duration : 4 years # Study mode : Full time # Course level : UG # Details : This is a four year full time B. Tech Electrical Engineering course. >< Course Name : B. TECH ELECTRICAL AND ELECTRONICS ENGINEERING # Eligibility : Pass in 12th/PUC/equivalent exams or ISC/CBSE with an average of 45% in Physics$ Mathematics and Chemistry/ Computer Science/ Electronics. In case of SC$ ST and OBC category candidates an average of 40% in Physics$ Mathematics and Chemistry/ Computer Science/ Electronics is required. # Duration : 4 years # Study mode : Full time # Approved intake : 120 # Course level : UG # Course Fee : 5 lakhs # Approval : University Grants Commission # Details : The department of Electrical and Electronics Engineering was established in the year 2006. The department has been in the forefront of advanced research in Electrical Engineering and has also been very pro-active in industrial interaction and technology development. >< Course Name : B. TECH ELECTRONICS ENGINEERING # Eligibility : The candidate should have 10+2 from any Recognized Board with relevant subjects. # Duration : 4 years # Study mode : Full time # Course level : UG # Details : This is a four year full time B. Tech Electronics Engineering course. >< Course Name : B. TECH ELECTRONICS AND COMMUNICATION ENGINEERING # Eligibility : Pass in 12th/PUC/equivalent exams or ISC/CBSE with an average of 45% in Physics$ Mathematics and Chemistry/ Computer Science/ Electronics. In case of SC$ ST and OBC category candidates an average of 40% in Physics$ Mathematics and Chemistry/ Computer Science/ Electronics is required. # Duration : 4 years # Study mode : Full time # Approved intake : 120 # Course level : UG # Course Fee : 5.6 lakhs # Approval : University Grants Commission # Details : The department of Electronics and Communication Engineering was established in the year 2005. This Department has been also recognized as an R&amp;D Centre by the Visvesvaraya Technological University for carrying our research work leading to the award of M.Sc. (Engg.) and Ph.D.
At present the faculty strength covers Power Electronics$ signal Processing$ Digital Communication Systems and Embedded Systems and VLSI$ Computer applications$ Biomedical Signal Processing as their specializations. They have wide experience in academics and industry. Some of our faculty members are involved in research work in different areas like Signal Processing$ MEMS$ Communication Systems and VLSI etc. The faculties always strive for imparting better knowledge to the students. They work as a team in all the departmental activities and never compromise on quality and standards of teaching. All staff members wholeheartedly volunteer for giving additional coaching to the needy students after the working hours of the college.
The final year students of this Department enjoy the privilege of carrying their project works at reputed organizations like Bharath Electronics Ltd.$ ISRO. Students graduated forms the department are well placed. Quite a few of them are pursuing their higher studies in India as well as abroad. A few of them have qualified for Indian Engineering and Defense Services. The first batch of students graduated from the department has shown very good performance with 32 First Class with Distinction and 18 First Class. Our students have also participated in various competitions and conferences$ the departmental faculty and students have published papers at the National and International level.
To combine the academic excellence with practical expertise students are also encouraged seeking out and pursuing projects with reputed Research and Industrial Organizations. >< Course Name : B. TECH INFORMATION SCIENCE AND ENGINEERING # Eligibility : Pass in 12th/PUC/equivalent exams or ISC/CBSE with an average of 45% in Physics$ Mathematics and Chemistry/ Computer Science/ Electronics. In case of SC$ ST and OBC category candidates an average of 40% in Physics$ Mathematics and Chemistry/ Computer Science/ Electronics is required. # Duration : 4 years # Study mode : Full time # Approved intake : 120 # Course level : UG # Course Fee : 5 lakhs # Approval : University Grants Commission # Details : The Department of Information Science and Engineering (ISE) is home to a pool of talents from different parts of the country. The department has become popular among students due to its achievements and rigor. The department has well equipped classrooms and computer laboratories with high-end systems. >< Course Name : B. TECH MECHANICAL ENGINEERING # Eligibility : Pass in 12th/PUC/equivalent exams or ISC/CBSE with an average of 45% in Physics$ Mathematics and Chemistry/ Computer Science/ Electronics. In case of SC$ ST and OBC category candidates an average of 40% in Physics$ Mathematics and Chemistry/ Computer Science/ Electronics is required. # Duration : 4 years # Study mode : Full time # Approved intake : 120 # Course level : UG # Course Fee : 5.6 lakhs # Approval : University Grants Commission # Details : The Department of Mechanical Engineering was established in the year 2006. A facility of repute$ excellent faculty and a good student community has contributed to make the Department vibrant and striving hard to achieve excellence in the area of academics and research. In keeping with the continued efforts for up-gradation and advancement of knowledge$ the Department has successfully completed the establishment of various labs as per the University requirements$ and care has been taken to procure some specialized equipment to inculcate an aptitude for research in faculty as well as students. The members of the faculty are actively involved in the Research and Development and have published papers in International &amp; National Journals and conferences. Two of the faculty members have successfully completed the Intellectual Property Rights Programme at I.I.Sc in June 2008.
The department also encourages the students to take part in sports$ cultural and social service activities. It is a matter of great pride to announce that department is going to start its own departmental library with industry catalogs$ cut section models etc. The department is also making efforts to submit proposals to various bodies for funding the projects. >",,,,,,,,,,,,,,,,,,,,,,,,,,,,,,,,,,,,,,,,,,,,,,,,,,,,,,,,,,,,,,,,,,,,,,,,,,,,,,,,,,,,,,,,,,,,,,,,,,,,,,,,,,,,,,,,,,,,,,,,,,,,,,,,,,,,,,,,,,,,,,,,,,,,,,,,,,,,,,,,,,,,,,,,,,,,,,,,,,,,,,,,,,,,,,,,,,,,,,,,,
